{
  "schema": 1,
  "stage": "er1-1-2-known-identity-targets",
  "candidates": [
    {
      "candidate_id": "candidate-identity-er1-1-2-193fc44098a05235f63fc215",
      "preferred_name": "桓伊",
      "status": "candidate",
      "matched_person_id": null,
      "materialization_state": "new_candidate",
      "surfaces": [
        {
          "surface": "桓伊",
          "surface_type": "personal_name",
          "association_mode": "exact",
          "association_strength": "strong",
          "source_layers": ["shishuo"],
          "evidence_ids": [
            "evidence-sc1-05-fangzheng-055-annotation-001",
            "evidence-p3a1-2e23ff3ddc0dda381c1d"
          ],
          "occurrence_count": 2
        },
        {
          "surface": "桓子野",
          "surface_type": "established_appellation",
          "association_mode": "exact",
          "association_strength": "strong",
          "source_layers": ["shishuo"],
          "evidence_ids": [
            "evidence-sc1-05-fangzheng-055-main",
            "evidence-sc1-05-fangzheng-055-annotation-001",
            "evidence-sc1-05-fangzheng-055-annotation-002"
          ],
          "occurrence_count": 6
        },
        {
          "surface": "子野",
          "surface_type": "textual_shorthand",
          "association_mode": "contextual",
          "association_strength": "strong",
          "source_layers": ["shishuo"],
          "evidence_ids": [
            "evidence-sc1-05-fangzheng-055-main",
            "evidence-sc1-05-fangzheng-055-annotation-001"
          ],
          "occurrence_count": 2
        },
        {
          "surface": "叔夏",
          "surface_type": "courtesy_name",
          "association_mode": "exact",
          "association_strength": "strong",
          "source_layers": ["shishuo", "jinshu"],
          "evidence_ids": [
            "evidence-sc1-05-fangzheng-055-annotation-002",
            "evidence-p3a1-a143cfffc2bfcbf75be5"
          ],
          "occurrence_count": 1
        }
      ],
      "identity_evidence_ids": [
        "evidence-sc1-05-fangzheng-055-annotation-001",
        "evidence-sc1-05-fangzheng-055-annotation-002",
        "evidence-p3a1-a143cfffc2bfcbf75be5"
      ],
      "evidence_ids": [
        "evidence-p3a1-2e23ff3ddc0dda381c1d",
        "evidence-p3a1-a143cfffc2bfcbf75be5",
        "evidence-sc1-05-fangzheng-055-annotation-001",
        "evidence-sc1-05-fangzheng-055-annotation-002",
        "evidence-sc1-05-fangzheng-055-main"
      ],
      "metrics": {
        "current_sc1_story_count": 1,
        "current_sc1_occurrence_count": 2,
        "shishuo_main_story_count": 1,
        "shishuo_annotation_story_count": 1,
        "jinshu_unit_count": 1
      },
      "shishuo_story_ids": ["05-fangzheng-055", "23-rendan-049"],
      "current_sc1_story_ids": ["05-fangzheng-055"],
      "current_sc1_occurrence_count": 3,
      "risk_flags": [
        "curated_er_identity_bridge",
        "nested_jinshu_biography_subject",
        "not_materialized",
        "shared_prefix_with_person-016"
      ],
      "identity_basis": [
        "explicit_liu_annotation_full_name",
        "processed_jinshu_identity_cue",
        "story_local_appellation_coreference"
      ]
    },
    {
      "candidate_id": "candidate-identity-er1-1-3-39b990b1195ed57c4fec0e84",
      "preferred_name": "阮咸",
      "status": "candidate",
      "matched_person_id": null,
      "materialization_state": "new_candidate",
      "surfaces": [
        {
          "surface": "阮咸",
          "surface_type": "personal_name",
          "association_mode": "exact",
          "association_strength": "strong",
          "source_layers": ["shishuo"],
          "evidence_ids": ["evidence-p3a1-c8c0b60c0dcb40cdf874"],
          "occurrence_count": 1
        },
        {
          "surface": "阮仲容",
          "surface_type": "surname_plus_courtesy_name",
          "association_mode": "exact",
          "association_strength": "strong",
          "source_layers": ["shishuo"],
          "evidence_ids": [
            "evidence-p3a1-c8c0b60c0dcb40cdf874",
            "evidence-w3-person-71a0b82a0c724037a9f86baf",
            "evidence-w3-person-bd034586f733862f92892113"
          ],
          "occurrence_count": 3
        },
        {
          "surface": "仲容",
          "surface_type": "courtesy_name",
          "association_mode": "contextual",
          "association_strength": "strong",
          "source_layers": ["shishuo"],
          "evidence_ids": [
            "evidence-p3a1-c8c0b60c0dcb40cdf874",
            "evidence-w3-person-28e11c144a6690df612f563b",
            "evidence-w3-person-71a0b82a0c724037a9f86baf",
            "evidence-w3-person-bd034586f733862f92892113"
          ],
          "occurrence_count": 8
        }
      ],
      "identity_evidence_ids": ["evidence-p3a1-c8c0b60c0dcb40cdf874"],
      "evidence_ids": [
        "evidence-p3a1-c8c0b60c0dcb40cdf874",
        "evidence-w3-person-28e11c144a6690df612f563b",
        "evidence-w3-person-71a0b82a0c724037a9f86baf",
        "evidence-w3-person-bd034586f733862f92892113"
      ],
      "metrics": {
        "current_sc1_story_count": 0,
        "current_sc1_occurrence_count": 0,
        "shishuo_main_story_count": 3,
        "shishuo_annotation_story_count": 2,
        "jinshu_unit_count": 0
      },
      "shishuo_story_ids": [
        "04-wenxue-094",
        "08-shangyu-012",
        "23-rendan-010",
        "23-rendan-012",
        "23-rendan-013",
        "23-rendan-015"
      ],
      "current_sc1_story_ids": [],
      "current_sc1_occurrence_count": 0,
      "risk_flags": [
        "shared_courtesy_name_with_person-037",
        "not_materialized",
        "bare_alias_requires_context"
      ],
      "identity_basis": [
        "explicit_liu_annotation_name_identity_cue",
        "story_local_full_appellation",
        "shared_alias_collision_audit"
      ]
    }
  ],
  "notes": [
    "These records are non-production identity targets for contextual resolution only.",
    "They do not allocate Person IDs, create PersonStory links, or make an identity navigable.",
    "The current P3A.1 artifact contains direct evidence for 桓伊 but no standalone candidate row because the processed Jinshu unit is headed 桓宣 and contains 伊字叔夏 as a nested biography. This curated ER bridge preserves that source-backed identity without changing P3A1 ranking semantics."
  ]
}
